[
  {
    "id": "hostinger-kvm-1-intro-2026-08-24",
    "region_id": null,
    "currency": "USD",
    "price_type": "intro",
    "price": 6.49,
    "billing_period": "term-month-equivalent",
    "term_months": 24,
    "observed_at": "2026-08-24",
    "source_id": "hostinger-vps-official-2026-08-24",
    "verification_status": "verified",
    "notes": "Public displayed monthly-equivalent rate; total is paid upfront.",
    "product_id": "hostinger-kvm-1"
  },
  {
    "id": "hostinger-kvm-1-renewal-2026-08-24",
    "region_id": null,
    "currency": "USD",
    "price_type": "renewal",
    "price": 11.99,
    "billing_period": "term-month-equivalent",
    "term_months": 24,
    "observed_at": "2026-08-24",
    "source_id": "hostinger-vps-official-2026-08-24",
    "verification_status": "verified",
    "notes": "Published 2-year renewal monthly-equivalent rate.",
    "product_id": "hostinger-kvm-1"
  },
  {
    "id": "hostinger-kvm-2-intro-2026-08-24",
    "region_id": null,
    "currency": "USD",
    "price_type": "intro",
    "price": 8.99,
    "billing_period": "term-month-equivalent",
    "term_months": 24,
    "observed_at": "2026-08-24",
    "source_id": "hostinger-vps-official-2026-08-24",
    "verification_status": "verified",
    "notes": "Public displayed monthly-equivalent rate; total is paid upfront.",
    "product_id": "hostinger-kvm-2"
  },
  {
    "id": "hostinger-kvm-2-renewal-2026-08-24",
    "region_id": null,
    "currency": "USD",
    "price_type": "renewal",
    "price": 14.99,
    "billing_period": "term-month-equivalent",
    "term_months": 24,
    "observed_at": "2026-08-24",
    "source_id": "hostinger-vps-official-2026-08-24",
    "verification_status": "verified",
    "notes": "Published 2-year renewal monthly-equivalent rate.",
    "product_id": "hostinger-kvm-2"
  },
  {
    "id": "hostinger-kvm-4-intro-2026-08-24",
    "region_id": null,
    "currency": "USD",
    "price_type": "intro",
    "price": 12.99,
    "billing_period": "term-month-equivalent",
    "term_months": 24,
    "observed_at": "2026-08-24",
    "source_id": "hostinger-vps-official-2026-08-24",
    "verification_status": "verified",
    "notes": "Public displayed monthly-equivalent rate; total is paid upfront.",
    "product_id": "hostinger-kvm-4"
  },
  {
    "id": "hostinger-kvm-4-renewal-2026-08-24",
    "region_id": null,
    "currency": "USD",
    "price_type": "renewal",
    "price": 28.99,
    "billing_period": "term-month-equivalent",
    "term_months": 24,
    "observed_at": "2026-08-24",
    "source_id": "hostinger-vps-official-2026-08-24",
    "verification_status": "verified",
    "notes": "Published 2-year renewal monthly-equivalent rate.",
    "product_id": "hostinger-kvm-4"
  },
  {
    "id": "hostinger-kvm-8-intro-2026-08-24",
    "region_id": null,
    "currency": "USD",
    "price_type": "intro",
    "price": 25.99,
    "billing_period": "term-month-equivalent",
    "term_months": 24,
    "observed_at": "2026-08-24",
    "source_id": "hostinger-vps-official-2026-08-24",
    "verification_status": "verified",
    "notes": "Public displayed monthly-equivalent rate; total is paid upfront.",
    "product_id": "hostinger-kvm-8"
  },
  {
    "id": "hostinger-kvm-8-renewal-2026-08-24",
    "region_id": null,
    "currency": "USD",
    "price_type": "renewal",
    "price": 49.99,
    "billing_period": "term-month-equivalent",
    "term_months": 24,
    "observed_at": "2026-08-24",
    "source_id": "hostinger-vps-official-2026-08-24",
    "verification_status": "verified",
    "notes": "Published 2-year renewal monthly-equivalent rate.",
    "product_id": "hostinger-kvm-8"
  },
  {
    "id": "vultr-hp-1gb-monthly-cap-2026-08-24",
    "region_id": null,
    "currency": "USD",
    "price_type": "monthly-cap",
    "price": 6,
    "billing_period": "month",
    "term_months": null,
    "observed_at": "2026-08-24",
    "source_id": "vultr-site-published-prices-2026-08-24",
    "verification_status": "partial",
    "notes": "Current site published price ladder; official billing docs confirm 672-hour cap for non-GPU server types.",
    "product_id": "vultr-hp-1gb"
  },
  {
    "id": "vultr-hp-1gb-hourly-2026-08-24",
    "region_id": null,
    "currency": "USD",
    "price_type": "hourly",
    "price": 0.00893,
    "billing_period": "hour",
    "term_months": null,
    "observed_at": "2026-08-24",
    "source_id": "vultr-billing-docs-2026-08-24",
    "verification_status": "partial",
    "notes": "Derived from published monthly figure / official 672-hour cap; verify live price before public precision claims.",
    "product_id": "vultr-hp-1gb"
  },
  {
    "id": "vultr-hp-4gb-monthly-cap-2026-08-24",
    "region_id": null,
    "currency": "USD",
    "price_type": "monthly-cap",
    "price": 24,
    "billing_period": "month",
    "term_months": null,
    "observed_at": "2026-08-24",
    "source_id": "vultr-site-published-prices-2026-08-24",
    "verification_status": "partial",
    "notes": "Current site published price ladder; official billing docs confirm 672-hour cap for non-GPU server types.",
    "product_id": "vultr-hp-4gb"
  },
  {
    "id": "vultr-hp-4gb-hourly-2026-08-24",
    "region_id": null,
    "currency": "USD",
    "price_type": "hourly",
    "price": 0.03571,
    "billing_period": "hour",
    "term_months": null,
    "observed_at": "2026-08-24",
    "source_id": "vultr-billing-docs-2026-08-24",
    "verification_status": "partial",
    "notes": "Derived from published monthly figure / official 672-hour cap; verify live price before public precision claims.",
    "product_id": "vultr-hp-4gb"
  },
  {
    "id": "vultr-hp-8gb-monthly-cap-2026-08-24",
    "region_id": null,
    "currency": "USD",
    "price_type": "monthly-cap",
    "price": 48,
    "billing_period": "month",
    "term_months": null,
    "observed_at": "2026-08-24",
    "source_id": "vultr-site-published-prices-2026-08-24",
    "verification_status": "partial",
    "notes": "Current site published price ladder; official billing docs confirm 672-hour cap for non-GPU server types.",
    "product_id": "vultr-hp-8gb"
  },
  {
    "id": "vultr-hp-8gb-hourly-2026-08-24",
    "region_id": null,
    "currency": "USD",
    "price_type": "hourly",
    "price": 0.07143,
    "billing_period": "hour",
    "term_months": null,
    "observed_at": "2026-08-24",
    "source_id": "vultr-billing-docs-2026-08-24",
    "verification_status": "partial",
    "notes": "Derived from published monthly figure / official 672-hour cap; verify live price before public precision claims.",
    "product_id": "vultr-hp-8gb"
  },
  {
    "id": "vultr-hp-16gb-monthly-cap-2026-08-24",
    "region_id": null,
    "currency": "USD",
    "price_type": "monthly-cap",
    "price": 96,
    "billing_period": "month",
    "term_months": null,
    "observed_at": "2026-08-24",
    "source_id": "vultr-site-published-prices-2026-08-24",
    "verification_status": "partial",
    "notes": "Current site published price ladder; official billing docs confirm 672-hour cap for non-GPU server types.",
    "product_id": "vultr-hp-16gb"
  },
  {
    "id": "vultr-hp-16gb-hourly-2026-08-24",
    "region_id": null,
    "currency": "USD",
    "price_type": "hourly",
    "price": 0.14286,
    "billing_period": "hour",
    "term_months": null,
    "observed_at": "2026-08-24",
    "source_id": "vultr-billing-docs-2026-08-24",
    "verification_status": "partial",
    "notes": "Derived from published monthly figure / official 672-hour cap; verify live price before public precision claims.",
    "product_id": "vultr-hp-16gb"
  },
  {
    "id": "digitalocean-basic-512mb-list-2026-08-24",
    "region_id": null,
    "currency": "USD",
    "price_type": "list",
    "price": 4,
    "billing_period": "month",
    "term_months": null,
    "observed_at": "2026-08-24",
    "source_id": "digitalocean-droplet-pricing-2026-08-24",
    "verification_status": "verified",
    "notes": "Official monthly cap/list price.",
    "product_id": "digitalocean-basic-512mb"
  },
  {
    "id": "digitalocean-basic-512mb-hourly-2026-08-24",
    "region_id": null,
    "currency": "USD",
    "price_type": "hourly",
    "price": 0.00595,
    "billing_period": "hour",
    "term_months": null,
    "observed_at": "2026-08-24",
    "source_id": "digitalocean-droplet-pricing-2026-08-24",
    "verification_status": "verified",
    "notes": "Official hourly equivalent shown in the pricing table; actual Droplet billing is per-second with a minimum charge.",
    "product_id": "digitalocean-basic-512mb"
  },
  {
    "id": "digitalocean-basic-1gb-list-2026-08-24",
    "region_id": null,
    "currency": "USD",
    "price_type": "list",
    "price": 6,
    "billing_period": "month",
    "term_months": null,
    "observed_at": "2026-08-24",
    "source_id": "digitalocean-droplet-pricing-2026-08-24",
    "verification_status": "verified",
    "notes": "Official monthly cap/list price.",
    "product_id": "digitalocean-basic-1gb"
  },
  {
    "id": "digitalocean-basic-1gb-hourly-2026-08-24",
    "region_id": null,
    "currency": "USD",
    "price_type": "hourly",
    "price": 0.00893,
    "billing_period": "hour",
    "term_months": null,
    "observed_at": "2026-08-24",
    "source_id": "digitalocean-droplet-pricing-2026-08-24",
    "verification_status": "verified",
    "notes": "Official hourly equivalent shown in the pricing table; actual Droplet billing is per-second with a minimum charge.",
    "product_id": "digitalocean-basic-1gb"
  },
  {
    "id": "digitalocean-basic-2gb-1vcpu-list-2026-08-24",
    "region_id": null,
    "currency": "USD",
    "price_type": "list",
    "price": 12,
    "billing_period": "month",
    "term_months": null,
    "observed_at": "2026-08-24",
    "source_id": "digitalocean-droplet-pricing-2026-08-24",
    "verification_status": "verified",
    "notes": "Official monthly cap/list price.",
    "product_id": "digitalocean-basic-2gb-1vcpu"
  },
  {
    "id": "digitalocean-basic-2gb-1vcpu-hourly-2026-08-24",